TTOPEDITOR-T-20-BA-MO,,,usyllo,aldonça,,,,,,,,,,,,,,Unas casas en esa dicha çibdad de toledo en la collaçion de la eglesia de sant viçente (…) Estas dichas casas fueron de ferrand gonçales usyllo Jurado e vesino de toledo (…)  A soror mari Rebel monja profesa (…)  despues de finada la dicha mari Rebel tenyendo el convento este tributo le dio e señalo a soror doña ynes de guzman monja profesa (...)  ferrand gonçales usyllo Jurado vendio las dichas casas con liçençia del monesterio al dicho pedro de la torre mercador e a la dicha aldonça usyllo su muger fija del dicho Jurado (...)  et este tributo esta con condiçion que cada e quando lo dieren en otras casas o tiendas o bodegas en esta çibdad tanto que no sean en el Arraval nin en el Alhandaque nin en la Juderia a vista de dos buenas personas tomados por amas partes,,,,,collación de San Vicente,,,Unas casas en esa dicha çibdad de toledo en la collaçion de la eglesia de sant viçente que han por linderos de la una parte casas de herederos del liçençiado ferrand gonçales usyllo que dios aya e de la otra parte casas de diego de sant pedro mercador que se sacaron de las casas que fueron de ferrand peres de guzman e de la otra parte a las espaldas con casas de martin de Rojas Regidor que fueron de françisco vasques su ahuelo e por delante la calle Real,,
TTOPEDITOR-T-20-BA-MO,,,ortiz,mari ,,,,,,,,,,,,,,Unas casas en esa dicha çibdad de toledo en la collaçion de la eglesia de sant viçente (…) Estas dichas casas fueron de ferrand gonçales usyllo Jurado e vesino de toledo (…)  A soror mari Rebel monja profesa (…)  despues de finada la dicha mari Rebel tenyendo el convento este tributo le dio e señalo a soror doña ynes de guzman monja profesa (...)  ferrand gonçales usyllo Jurado vendio las dichas casas con liçençia del monesterio al dicho pedro de la torre mercador e a la dicha aldonça usyllo su muger fija del dicho Jurado (...)  et este tributo esta con condiçion que cada e quando lo dieren en otras casas o tiendas o bodegas en esta çibdad tanto que no sean en el Arraval nin en el Alhandaque nin en la Juderia a vista de dos buenas personas tomados por amas partes (…) tiene mari ortiz muger del liçençiado gutierres de palma,,,,,collación de San Vicente,,,Unas casas en esa dicha çibdad de toledo en la collaçion de la eglesia de sant viçente que han por linderos de la una parte casas de herederos del liçençiado ferrand gonçales usyllo que dios aya e de la otra parte casas de diego de sant pedro mercador que se sacaron de las casas que fueron de ferrand peres de guzman e de la otra parte a las espaldas con casas de martin de Rojas Regidor que fueron de françisco vasques su ahuelo e por delante la calle Real,,
TTOPEDITOR-T-20-BA-MO,,, gutierres ,,de palma,,,,,,,,,,,,1516,Unas casas en esa dicha çibdad de toledo en la collaçion de la eglesia de sant viçente (…) Estas dichas casas fueron de ferrand gonçales usyllo Jurado e vesino de toledo (…)  A soror mari Rebel monja profesa (…)  despues de finada la dicha mari Rebel tenyendo el convento este tributo le dio e señalo a soror doña ynes de guzman monja profesa (...)  ferrand gonçales usyllo Jurado vendio las dichas casas con liçençia del monesterio al dicho pedro de la torre mercador e a la dicha aldonça usyllo su muger fija del dicho Jurado (...)  et este tributo esta con condiçion que cada e quando lo dieren en otras casas o tiendas o bodegas en esta çibdad tanto que no sean en el Arraval nin en el Alhandaque nin en la Juderia a vista de dos buenas personas tomados por amas partes (…) tiene mari ortiz muger del liçençiado gutierres de palma,,,,,collación de San Vicente,,,Unas casas en esa dicha çibdad de toledo en la collaçion de la eglesia de sant viçente que han por linderos de la una parte casas de herederos del liçençiado ferrand gonçales usyllo que dios aya e de la otra parte casas de diego de sant pedro mercador que se sacaron de las casas que fueron de ferrand peres de guzman e de la otra parte a las espaldas con casas de martin de Rojas Regidor que fueron de françisco vasques su ahuelo e por delante la calle Real,,
TTOPEDITOR-T-20-BA-MO,,,,La Mariscala de Castilla,,,,,,,,,,,,,1516,en esta parroquia tiene este convento (…)  casas a la calle que llaman de la lechuga (…) Estas casas las tiene al presente don Pedro Alcantara de el consejo de la Governacion y las paga la mariscala de Castilla ,,,,casas de la lechuga,collación de San Vicente,Calle de la lechuga,,"casas a la calle que llaman de la lechuga, qui es la tercera a la mano izquierda como vamos de San Gioness a la parrochia de Santa Justa y por las espaldas linda con casas d elos herederos de Blas Gonzlez mercader y por la parte de azia Santa Justa con casas de don Francisco Ximenez jurado",,
TTOPEDITOR-T-20-BA-MO,,,Alcantara,don Pedro,,,,,,,,,,,,,,en esta parroquia tiene este convento (…)  casas a la calle que llaman de la lechuga (…) Estas casas las tiene al presente don Pedro Alcantara de el consejo de la Governacion y las paga la mariscala de Castilla ,,,,casas de la lechuga,collación de San Vicente,Calle de la lechuga,,"casas a la calle que llaman de la lechuga, qui es la tercera a la mano izquierda como vamos de San Gioness a la parrochia de Santa Justa y por las espaldas linda con casas d elos herederos de Blas Gonzlez mercader y por la parte de azia Santa Justa con casas de don Francisco Ximenez jurado",,
TTOPEDITOR-T-20-BA-MO,,,Cota,Francisco ,,,,,,,,,,,,judío*,," le tesorero Francisco Cota oblige à la sécurité de la dot (…) de sa bru Elvira de Torres, femme de son fils, Fernand Suárez, une maison située à la perrocha de S. GinésLa dot a été payée par le chanoine Juan de Contreras",colación de S. Ginés,,,,,,,"une maison située à la perrocha de S. Ginés, jouxtant une maison du jurado Fernando de San Pedro, une maison de Juan Hurtado, mercader, une maison de Fernando Ortiz, escribano du corregidor, et la rue",,
TTOPEDITOR-T-20-BA-MO,,,de zarate ,Alonso,,,,,,,,,tejedor de terciopelo,,,,,"casa de Alonso de zarate tejedor de terciopelo (…) 1533 la cofradía Santa Caridad vendio estas casas  vendieron a Alonso Montabon 
",,Calle de los Tintoreros,alinda casa de alvar gonzalez noalle y casas de Pedro Jarada mercader y calle real,La mosquée des musulmans,Calle de las Tornerías,,,,,
TTOPEDITOR-T-20-BA-MO,,,Montabon,Alonso,,,,,,,,,,,,,1533,,,,,,Calle de las Tornerías,,,,,
TTOPEDITOR-T-20-BA-MO,,,,,,,,,,,,,pellejeros,,,,1385," des pellejeros résident dans des tiendas (…) figurant parmi les biens affectés à la chapellenie de don Fernand Gómez, selon la déclaration de doña Inés de Ayala, veuve de don Diego Gómez, qui donne deux tiendas où demeurent des pellejeros",,,"des tiendas situées au dos de la mosquée (…)  où demeurent des pellejeros, situées a las espaldas de la mesquita que agora tienen los moros, ces tiendas en jouxtant une autre appartenant à Juan Gaitán, et un terrain alors vide",,,,,,,
TTOPEDITOR-T-20-BA-MO,,,Guas,Juan,,,,,, maestro mayor des travaux de San Juan de los Reyes,,,,,,,5/12/1486,"Juan Guas, maestro mayor des travaux de San Juan de los Reyes, reconnaît (…) une casa tienda achetée par lui (…) de Juan Jarada, mercador",colación de la Magdalena,calle de la zapatería,"située à la colación de la Magdalena, dans la calle de la zapatería, au dos de la mezquita de los moros, jouxtant une maison de Juan de Valladolid et une maison de Marina Rodríguez, veuve de Fernand Pérez de Aguilera",colación de la Magdalena,,,,,,
TTOPEDITOR-T-20-BA-MO,,,García,doña Elvira,de Fuensalida,,,,,,,,,,,,,"doña Elvira García de Fuensalida, veuve de Juan Núñez de Aguilar, dispose d'un certain nombre de tiendas",,calle de la Bercería/  calle de los tintores,"l'une est située dans la rue de la Bercería, une autre à côté de la mezquita de los moros, et une autre encore dans la calle de los tintores, en allant à la Pescaderia",,Calle de las Tornerías,,,,,
TTOPEDITOR-T-20-BA-MO,,,de Meneses,doña Guiomar,,,,,,,,,,,,,5/05/1458," doña Guiomar de Meneses, veuve de Lope Gaitán, la dame reçoit notamment une tienda située à la colación de San Pedro de las Cuatro Calles (...) boutique tenue à cens par Catalina Alvarez, veuve de Juan de Alcaraz, abogado, et son fils, Diego",,calle de los tintoreros,"une tienda située à la colación de San Pedro de las Cuatro Calles, dans la calle de los tintoreros, jouxtant une maison de Juan González, tintor, et au dos la mezquita de los moros",colación de San Pedro de las Cuatro Calles,,,,,,
TTOPEDITOR-T-20-BA-MO,,,Alvarez,Catalina,,,,,,,,,,,,,5/05/1458," doña Guiomar de Meneses, veuve de Lope Gaitán, la dame reçoit notamment une tienda située à la colación de San Pedro de las Cuatro Calles (...) boutique tenue à cens par Catalina Alvarez, veuve de Juan de Alcaraz, abogado, et son fils, Diego",,calle de los tintoreros,"une tienda située à la colación de San Pedro de las Cuatro Calles, dans la calle de los tintoreros, jouxtant une maison de Juan González, tintor, et au dos la mezquita de los moros",colación de San Pedro de las Cuatro Calles,,,,,,
TTOPEDITOR-T-20-BA-MO,,,,Diego,,,,,,,,,,,,,5/05/1458," doña Guiomar de Meneses, veuve de Lope Gaitán, la dame reçoit notamment une tienda située à la colación de San Pedro de las Cuatro Calles (...) boutique tenue à cens par Catalina Alvarez, veuve de Juan de Alcaraz, abogado, et son fils, Diego",,calle de los tintoreros,"une tienda située à la colación de San Pedro de las Cuatro Calles, dans la calle de los tintoreros, jouxtant une maison de Juan González, tintor, et au dos la mezquita de los moros",colación de San Pedro de las Cuatro Calles,,,,,,
TTOPEDITOR-T-20-BA-MO,,,Suárez,Gómez,de Figueroa,,,,,commandeur ,,,,,,, 11/10/1459,"dans le partage des biens du commandeur Gómez Suárez de Figueroa et de sa femme, doña Mencía de Torquemada, il revient à leur fils, Gómez de Figueroa, notamment, une tienda située à la calle de los tintoreros",,calle de los tintoreros,"une tienda située à la calle de los tintoreros, en dessous du palais de Diego García de Toledo, soit l'actuel Corral de don Diego, jouxtant une tienda de Juan de Atienza, tenue à cens par Antón Rodríguez, fils de Men Rodríguez (…)  la maison de Diego García de Toledo montre que l'on se trouve du côté gauche à la descente de l'actuelle Calle de las Tornerías",,Calle de las Tornerías,,,,,
TTOPEDITOR-T-20-BA-MO,,,de Torquemada, doña Mencía,,,,,,,,,,,,, 11/10/1459,"dans le partage des biens du commandeur Gómez Suárez de Figueroa et de sa femme, doña Mencía de Torquemada, il revient à leur fils, Gómez de Figueroa, notamment, une tienda située à la calle de los tintoreros",,calle de los tintoreros,"une tienda située à la calle de los tintoreros, en dessous du palais de Diego García de Toledo, soit l'actuel Corral de don Diego, jouxtant une tienda de Juan de Atienza, tenue à cens par Antón Rodríguez, fils de Men Rodríguez (…)  la maison de Diego García de Toledo montre que l'on se trouve du côté gauche à la descente de l'actuelle Calle de las Tornerías",,Calle de las Tornerías,,,,,
TTOPEDITOR-T-20-BA-MO,,,de Figueroa,Gómez,,,,,,,,,,,,, 11/10/1459,"dans le partage des biens du commandeur Gómez Suárez de Figueroa et de sa femme, doña Mencía de Torquemada, il revient à leur fils, Gómez de Figueroa, notamment, une tienda située à la calle de los tintoreros",,calle de los tintoreros,"une tienda située à la calle de los tintoreros, en dessous du palais de Diego García de Toledo, soit l'actuel Corral de don Diego, jouxtant une tienda de Juan de Atienza, tenue à cens par Antón Rodríguez, fils de Men Rodríguez (…)  la maison de Diego García de Toledo montre que l'on se trouve du côté gauche à la descente de l'actuelle Calle de las Tornerías",,Calle de las Tornerías,,,,,
TTOPEDITOR-T-20-BA-MO,,,Vázquez,Teresa ,de Guzmán,,,,,religiosa del Monasterio de Santo Domingo el Real,,,,,,,1460,"Santo Domingo el Real possède une maison, à la colación de San Pedro de las Cuatro Calles, dans la calle de las Cebollas, a los tintores, appartenant à Teresa Vázquez de Guzmán, religieuse du monastère",,calle de las Cebollas/ calle de los tintores,"une maison, à la colación de San Pedro de las Cuatro Calles, dans la calle de las Cebollas, a los tintores (…)  jouxtant d'une part une maison de Juan González de Sevilla, tintor, et de l'autre une maison de Diego Rodríguez, zapatero, avec deux portes sur la rue",colación de San Pedro de las Cuatro Calles,Calle de las Tornerías,,,,,
TTOPEDITOR-T-20-BA-MO,,,Fernández,Juan,,,,,,,,, zapatero,,,,19/08/1485,"Juan Fernández, zapatero, loue à Pedro de Ajofrín, zapatero, une maison qu'il a lui-même prise en location de Juan Jarada, située dans les Cuatro Calles (…) au prix de 2.400 mrs. et trois paires de poules par an, plus huit paires de sandales de cuir (servillas de vadana)",,Cuatro Calles/ Calle de los Torneros,"située dans les Cuatro Calles, à la Calle de los Torneros, jouxtant une maison de Juan de Valladolid et la mezquita de los moros",Colación Cuatro Calles,Calle de las Tornerías,,,,,
TTOPEDITOR-T-20-BA-MO,,,de Ajofrín,Pedro,,,,,,,,, zapatero,,,,19/08/1485," Juan Fernández, zapatero, loue à Pedro de Ajofrín, zapatero, une maison qu'il a lui-même prise en location de Juan Jarada, située dans les Cuatro Calles (…) au prix de 2.400 mrs. et trois paires de poules par an, plus huit paires de sandales de cuir (servillas de vadana)",,Cuatro Calles/ Calle de los Torneros,"située dans les Cuatro Calles, à la Calle de los Torneros, jouxtant une maison de Juan de Valladolid et la mezquita de los moros",Colación Cuatro Calles,Calle de las Tornerías,,,,,
TTOPEDITOR-T-20-BA-MO,,,Jarada,Juan,,,,,,,,,,,,,19/08/1485,"Juan Fernández, zapatero, loue à Pedro de Ajofrín, zapatero, une maison qu'il a lui-même prise en location de Juan Jarada, située dans les Cuatro Calles (…) au prix de 2.400 mrs. et trois paires de poules par an, plus huit paires de sandales de cuir (servillas de vadana)",,Cuatro Calles/ Calle de los Torneros,"située dans les Cuatro Calles, à la Calle de los Torneros, jouxtant une maison de Juan de Valladolid et la mezquita de los moros",Colación Cuatro Calles,Calle de las Tornerías,,,,,
TTOPEDITOR-T-20-BA-MO,,,Alfonso,Martín ,Cota,,el viejo,,,,,,mercador,,,judío*,21/08/1508,"Martín Alfonso Cota, el viejo, mercador, loue à Pedro de Ajofrín, zapatero, une casa tienda",,calle de la Tornería,"une casa tienda, située à la colación de la chapelle de S. Pedro, en la calle de la Tornería, jouxtant une maison d'Aguirre, qui fut alguacil mayor, et une maison de Juan de Robledo, agujetero",Colación de la chapelle de S. Pedro,,,,,,
TTOPEDITOR-T-20-BA-MO,,,de Ajofrín,Pedro,,,,,,,,, zapatero,,,,21/08/1508,"Martín Alfonso Cota, el viejo, mercador, loue à Pedro de Ajofrín, zapatero, une casa tienda",,calle de la Tornería,"une casa tienda, située à la colación de la chapelle de S. Pedro, en la calle de la Tornería, jouxtant une maison d'Aguirre, qui fut alguacil mayor, et une maison de Juan de Robledo, agujetero",Colación de la chapelle de S. Pedro,,,,,,
TTOPEDITOR-T-20-BA-MO,,,Carrillo,Pedro,,,,,, copero mayor du roi , alguacil mayor de la ville,,,,,,1409,"les autorités municipales de Tolède, réunies dans le cloître neuf de la cathédrale, font donation à Pedro Carrillo, copero mayor du roi et alguacil mayor de la ville, d'un terrain (solar)",,,"un terrain (solar) situé a las espaldas de las casas del Corpore Christi, que son a la moreria desde esquina a esquina, que es en la plaça de la pescaderia, çerca de la carnesçeria, jouxtant con casas del dicho ospital de Corpore Christi, avec pour condition que reste ouvert le caniveau voisin, pour que les poissonnières y jettent l'eau du remouillage de leurs poissons (el canno que esta çerca del dicho solar, para que este abierto, segun lo agora esta, por donde echen las pescaderas las aguas del remojo de sus pescados)",Morería,,,,,,
TTOPEDITOR-T-20-BA-MO,,,,,,,,,,,,,,,,,1162,est vendue une maison située au dessus de la Boucherie,,La Correería,"située au dessus de la Boucherie, dans la Correería (super carnezeriam in la Correaria)",Carnicerías,,,,,,
TTOPEDITOR-T-20-BA-MO,,,,,,,,,,,,,,,,, 1220,"on a le marché des bouchers et des savetiers (sūq al-ǧazzārīn wal-sabaṭayrīn), dans la ḥawma de la Cathédrale (min ḥawmat al-qā‘idat Šanta Mariyya), avec une ruelle (zunayqa), qui était auparavant une boutique (ḥānut) et se trouve en ruine, et jouxte  notamment une rue passante (ṭarīq sālik), une boutique et  un corral du roi (ḥanūt wa-qurrāl li-man ayyada-hu Allāh), et un mesón de la Cathédrale",,,,,,,,,,
TTOPEDITOR-T-20-BA-MO,,,,Ferdinand IV,,,,,,Rey,,,,,,,1304,"le roi Ferdinand IV, à la requête d'Alfonso López de Saavedra, son mayordomo, fait donation à Esteban Fernández son criado et escribano de los libros de  la despensa de sa maison, pour sa vie, d'un mesón",,,"un mesón, dit de Juan González, jouxtant d'un côté la Carnicería, attenante à la cathédrale, et de l'autre la Cal de la Pescadería",Carnicerías,,,,,,
TTOPEDITOR-T-20-BA-MO,,,Fernández,Esteban,,,,,,escribano de los libros de  la despensa de Alfonso López de Saavedra,,,criado,,,,1304,"le roi Ferdinand IV, à la requête d'Alfonso López de Saavedra, son mayordomo, fait donation à Esteban Fernández son criado et escribano de los libros de  la despensa de sa maison, pour sa vie, d'un mesón",,,"un mesón, dit de Juan González, jouxtant d'un côté la Carnicería, attenante à la cathédrale, et de l'autre la Cal de la Pescadería",Carnicerías,,,,,,
TTOPEDITOR-T-20-BA-MO,,,,doña Romera,,,,,,,,,,,,,12/09/1317,"le chapitre baille pour six ans à doña Romera, veuve de Martín Esteban, et à Menga Ibáñez, veuve de Lazaro Pérez une maison, située sobre la pescaderia",,La Pescadería,"une maison, située sobre la pescaderia, jouxtant une maison de María Ibáñez, la pescadera",,,,,,,
TTOPEDITOR-T-20-BA-MO,,,Ibáñez,Menga ,,,,,,,,,,,,,12/09/1317,"le chapitre baille pour six ans à doña Romera, veuve de Martín Esteban, et à Menga Ibáñez, veuve de Lazaro Pérez une maison, située sobre la pescaderia",,La Pescadería,"une maison, située sobre la pescaderia, jouxtant une maison de María Ibáñez, la pescadera",,,,,,,
TTOPEDITOR-T-20-BA-MO,,,de Valpuesta,Juan,,,,,,,,,"criado de Fernand Gómez, camarero mayor del Rey",,,,26/07/1331,"devant Fernand Alfonso, alcalde à Tolède pour Martín Fernández, que le chapitre cathédral possède un mesón situé près de la Carnicería et près de la Pescadería, est est présentée une lettre du roi Fernando (IV) (…)  donnant à Juan de Valpuesta, mio ome, et criado de Fernand Gómez, camarero mayor du roi, pour services rendus, le mesón dit de las dos puertas, avec ses poyos",,La Pescadería/ La Carnicería,"un mesón situé près de la Carnicería et près de la Pescadería (…)  le mesón dit de las dos puertas, avec ses poyos, situé à Tolède, près de la cathédrale",Mesón de las Dos Puertas,,,,,,
TTOPEDITOR-T-20-BA-MO,,CH_XO_00,Fernández,Alfonso,de Roa,,,,,,,,,,,,1372,"Alfonso Fernández de Roa, et sa femme, María Alfonso, tiennent une tienda",,Calle de los Masleadores, a los Masleadores (…) une tienda (…)  c'était auparavant deux tiendas,,,,,,,
TTOPEDITOR-T-20-BA-MO,,CH_XO_00,Alfonso,María,,,,,,,,,,,,,1372,"Alfonso Fernández de Roa, et sa femme, María Alfonso, tiennent une tienda",,Calle de los Masleadores, a los Masleadores (…) une tienda (…)  c'était auparavant deux tiendas,,,,,,,
TTOPEDITOR-T-20-BA-MO,,CH_XO_00,González,Juan,,,,,,,,,criado de Tel García,,,,1391,"Juan González, criado de Tel García, tient una tienda qui en était auparavant deux",,,,,,,,,,
TTOPEDITOR-T-20-BA-MO,,CH_XO_00, Alfonso,Juan,,,,,,,,,tejedor,,,,8/08/1395," le chapitre baille à Juan Alfonso, tejedor, et María Rodriguez, sa femme, demeurant à la colación de la chapelle de S. Pedro, une tendecilla située près de la Carniceria",,,,,,,,,,
TTOPEDITOR-T-20-BA-MO,,CH_XO_00,Rodriguez,María,,,,,,,,,,,,,8/08/1395," le chapitre baille à Juan Alfonso, tejedor, et María Rodriguez, sa femme, demeurant à la colación de la chapelle de S. Pedro, une tendecilla située près de la Carniceria",,,,,,,,,,
TTOPEDITOR-T-20-BA-MO,,CH_XO_00, Alfonso,Juan,,,,,,,,,tejedor,,,,1396," a los Musleadores, la tienda que tenait auparavant Juan González, criado de Tel García, est tenue par Juan Alfonso, tejedor, et María Rodríguez, sa femme",,Calle de los Masleadores,,,,,,,,
TTOPEDITOR-T-20-BA-MO,,CH_XO_00,Rodriguez,María,,,,,,,,,,,,,1396," a los Musleadores, la tienda que tenait auparavant Juan González, criado de Tel García, est tenue par Juan Alfonso, tejedor, et María Rodríguez, sa femme",,Calle de los Masleadores,,,,,,,,
TTOPEDITOR-T-20-BA-MO,,CH_XO_00,Sánchez,Fernand ,,,,,,,,,peraile,,,,1408," a la Carnicería, Fernand Sánchez, peraile, et María Rodríguez, sa femme, tiennent la tienda auparavant tenue par Juan Gutiérrez, criado de Tel García, et qui avait été deux tiendas",, La Carnicería,,,,,,,,
TTOPEDITOR-T-20-BA-MO,,CH_XO_00,Rodríguez,María,,,,,,,,,,,,,1408," a la Carnicería, Fernand Sánchez, peraile, et María Rodríguez, sa femme, tiennent la tienda auparavant tenue par Juan Gutiérrez, criado de Tel García, et qui avait été deux tiendas",, La Carnicería,,,,,,,,
TTOPEDITOR-T-20-BA-MO,,CH_XO_00,Sánchez,Fernand ,,,,,,,,,peraile,,,,1417,"Fernand Sánchez, peraile, et sa femme, María Díaz, tiennent la tienda, à la Carnicería, que tenait Juan Gutiérrez, criado de Tel García, qui était deux tiendas",, La Carnicería,,,,,,,,
TTOPEDITOR-T-20-BA-MO,,CH_XO_00,Rodríguez,María,,,,,,,,,,,,,1417,"Fernand Sánchez, peraile, et sa femme, María Díaz, tiennent la tienda, à la Carnicería, que tenait Juan Gutiérrez, criado de Tel García, qui était deux tiendas",, La Carnicería,,,,,,,,
TTOPEDITOR-T-20-BA-MO,,CH_XO_01,Rodríguez,Juan,de Esquivias,,,,,,,,,,,,1372,"Juan Rodríguez de Esquivias tient la maison que tenait auparavant , à la plaça de María Alfonso, Juan García de la Burosa",,,,,,,,,,
TTOPEDITOR-T-20-BA-MO,,CH_XO_01,Alfonso,María,,,,,,,,,,,,,1372,"Juan Rodríguez de Esquivias tient la maison que tenait auparavant , à la plaça de María Alfonso, Juan García de la Burosa",,,,,,,,,,
TTOPEDITOR-T-20-BA-MO,,CH_XO_01,García,Juan,de la Burosa,,,,,,,,,,,,1372,"Juan Rodríguez de Esquivias tient la maison que tenait auparavant , à la plaça de María Alfonso, Juan García de la Burosa",,,,,,,,,,
TTOPEDITOR-T-20-BA-MO,CH_XO_01,,Alfonso,Guisabel,,Isabel,,,,,,,,,,,1380,"Guisabel Alfonso, qui était la femme de Juan Rodríguez de Esquivias, tient la maison que tenait auparavant Juan de Podanque (…) Guisabel Alfonso (ou Isabel Alfonso), qui était la femme de Juan Rodríguez, tient la maison que tenait Juan de Podanque, pour 25 mrs. que paie María García, la beata",,,,, La Carnicería,,,"tient la maison que tenait, à la Carnicería",,
TTOPEDITOR-T-20-BA-MO,CH_XO_01,,de Podanque,Juan,,,,,,,,,,,,,,"Guisabel Alfonso, qui était la femme de Juan Rodríguez de Esquivias, tient la maison que tenait auparavant Juan de Podanque (…) Guisabel Alfonso (ou Isabel Alfonso), qui était la femme de Juan Rodríguez, tient la maison que tenait Juan de Podanque, pour 25 mrs. que paie María García, la beata",,,,, La Carnicería,,,"tient la maison que tenait, à la Carnicería",,
TTOPEDITOR-T-20-BA-MO,CH_XO_01,,García,doña María,,la beata,,,,,,,,,,,1412,"doña María García, tient la maison que tenait, à la Carnicería, Isabel Alfonso, qui était la femme de Juan Rodríguez, et (auparavant) Juan de Podanque",,,,, La Carnicería,,,"tient la maison que tenait, à la Carnicería",,
TTOPEDITOR-T-20-BA-MO,,CH_XO_01,González ,Fernand,de Gómara,,,,,,,,bachiller,,,,1439," la maison que tenait auparavant doña María García, la beata, est tenue à cens par le bachelier Fernand González de Gomara",, La Carnicería,"jouxte d'un côté une maison de Pedro Gutiérrez, et de l'autre une maison de la Hermandad de los capellanes",,,,,,,
TTOPEDITOR-T-20-BA-MO,,CH_XO_01,González ,Fernand,de Gómara,,,,,,,,bachiller,,,,1/10/1438," la maison que tenait doña Maria García, la beata, a été donnée à cens, le 1/10/1438, à Fernand González de Gómara, bachiller (…)  En 1450, doit payer pour cette maison Francisco López, fils de Fernand López de la Palanca",,,,,,,,,,
TTOPEDITOR-T-20-BA-MO,,CH_XO_01,López,Francisco ,,,,,,,,,,,,,1450," la maison que tenait doña Maria García, la beata, a été donnée à cens, le 1/10/1438, à Fernand González de Gómara, bachiller (…)  En 1450, doit payer pour cette maison Francisco López, fils de Fernand López de la Palanca",,,,,,,,,,
TTOPEDITOR-T-20-BA-MO,,CH_XO_01,García,Alfonso ,de Cuerva,,,,,escribano del rey,,,,,,,1465,"la maison que tenait à cens Alfonso García de Cuerva, escribano del rey, (…)  a été échangée par le chapitre avec les clercs de la Magdalena qu'ils avaient sur une maison que tenait, au Zocodover, Alfonso Rodríguez, jurado, et que le chapitre a réunie avec le mesón nouveau qui a brûlé, pour y faire une maison",,,,,,,Zocodover," la maison (…) au dessus de la maison des beatas (…)  une maison que tenait, au Zocodover (…)  a réunie avec le mesón nouveau qui a brûlé, pour y faire une maison",,
